eco	name	pgn	uci_moves	games
C39	King's Gambit Accepted: Kieseritzky Gambit, Berlin Defense	1. e4 e5 2. f4 exf4 3. Nf3 g5 4. h4 g4 5. Ne5 Nf6	['e2e4', 'e7e5', 'f2f4', 'e5f4', 'g1f3', 'g7g5', 'h2h4', 'g5g4', 'f3e5', 'g8f6']	36830
C39	King's Gambit Accepted: Kieseritzky Gambit, Berlin Defense, Rubinstein Variation	1. e4 e5 2. f4 exf4 3. Nf3 g5 4. h4 g4 5. Ne5 Nf6 6. d4	['e2e4', 'e7e5', 'f2f4', 'e5f4', 'g1f3', 'g7g5', 'h2h4', 'g5g4', 'f3e5', 'g8f6', 'd2d4']	3790
C39	King's Gambit Accepted: Kieseritzky Gambit, Berlin Defense, de Riviere Variation	1. e4 e5 2. f4 exf4 3. Nf3 g5 4. h4 g4 5. Ne5 Nf6 6. Nxg4 d5	['e2e4', 'e7e5', 'f2f4', 'e5f4', 'g1f3', 'g7g5', 'h2h4', 'g5g4', 'f3e5', 'g8f6', 'e5g4', 'd7d5']	1501
C39	King's Gambit Accepted: Kieseritzky Gambit, Brentano Defense	1. e4 e5 2. f4 exf4 3. Nf3 g5 4. h4 g4 5. Ne5 d5	['e2e4', 'e7e5', 'f2f4', 'e5f4', 'g1f3', 'g7g5', 'h2h4', 'g5g4', 'f3e5', 'd7d5']	8603
C39	King's Gambit Accepted: Kieseritzky Gambit, Brentano Defense	1. e4 e5 2. f4 exf4 3. Nf3 g5 4. h4 g4 5. Ne5 d5 6. d4 Nf6 7. Bxf4	['e2e4', 'e7e5', 'f2f4', 'e5f4', 'g1f3', 'g7g5', 'h2h4', 'g5g4', 'f3e5', 'd7d5', 'd2d4', 'g8f6', 'c1f4']	273
C39	King's Gambit Accepted: Kieseritzky Gambit, Brentano Defense, Caro Variation	1. e4 e5 2. f4 exf4 3. Nf3 g5 4. h4 g4 5. Ne5 d5 6. d4 Nf6 7. Bxf4 Nxe4 8. Nd2	['e2e4', 'e7e5', 'f2f4', 'e5f4', 'g1f3', 'g7g5', 'h2h4', 'g5g4', 'f3e5', 'd7d5', 'd2d4', 'g8f6', 'c1f4', 'f6e4', 'b1d2']	44
C39	King's Gambit Accepted: Kieseritzky Gambit, Cotter Gambit	1. e4 e5 2. f4 exf4 3. Nf3 g5 4. h4 g4 5. Ng5 h6 6. Nxf7	['e2e4', 'e7e5', 'f2f4', 'e5f4', 'g1f3', 'g7g5', 'h2h4', 'g5g4', 'f3g5', 'h7h6', 'g5f7']	113605
C39	King's Gambit Accepted: Kieseritzky Gambit, Kolisch Defense	1. e4 e5 2. f4 exf4 3. Nf3 g5 4. h4 g4 5. Ne5 d6	['e2e4', 'e7e5', 'f2f4', 'e5f4', 'g1f3', 'g7g5', 'h2h4', 'g5g4', 'f3e5', 'd7d6']	125461
C39	King's Gambit Accepted: Kieseritzky Gambit, Long Whip	1. e4 e5 2. f4 exf4 3. Nf3 g5 4. h4 g4 5. Ne5 h5	['e2e4', 'e7e5', 'f2f4', 'e5f4', 'g1f3', 'g7g5', 'h2h4', 'g5g4', 'f3e5', 'h7h5']	125074
C39	King's Gambit Accepted: Kieseritzky Gambit, Neumann Defense	1. e4 e5 2. f4 exf4 3. Nf3 g5 4. h4 g4 5. Ne5 Nc6	['e2e4', 'e7e5', 'f2f4', 'e5f4', 'g1f3', 'g7g5', 'h2h4', 'g5g4', 'f3e5', 'b8c6']	3492
C39	King's Gambit Accepted: Kieseritzky Gambit, Paulsen Defense	1. e4 e5 2. f4 exf4 3. Nf3 g5 4. h4 g4 5. Ne5 Bg7	['e2e4', 'e7e5', 'f2f4', 'e5f4', 'g1f3', 'g7g5', 'h2h4', 'g5g4', 'f3e5', 'f8g7']	4098
C39	King's Gambit Accepted: Kieseritzky Gambit, Paulsen Defense Deferred	1. e4 e5 2. f4 exf4 3. Nf3 g5 4. h4 g4 5. Ne5 Nf6 6. Bc4 d5 7. exd5 Bg7	['e2e4', 'e7e5', 'f2f4', 'e5f4', 'g1f3', 'g7g5', 'h2h4', 'g5g4', 'f3e5', 'g8f6', 'f1c4', 'd7d5', 'e4d5', 'f8g7']	659
C39	King's Gambit Accepted: Kieseritzky Gambit, Rice Gambit	1. e4 e5 2. f4 exf4 3. Nf3 g5 4. h4 g4 5. Ne5 Nf6 6. Bc4 d5 7. exd5 Bd6 8. O-O Bxe5	['e2e4', 'e7e5', 'f2f4', 'e5f4', 'g1f3', 'g7g5', 'h2h4', 'g5g4', 'f3e5', 'g8f6', 'f1c4', 'd7d5', 'e4d5', 'f8d6', 'e1g1', 'd6e5']	97
C39	King's Gambit Accepted: Kieseritzky Gambit, Rosenthal Defense	1. e4 e5 2. f4 exf4 3. Nf3 g5 4. h4 g4 5. Ne5 Qe7	['e2e4', 'e7e5', 'f2f4', 'e5f4', 'g1f3', 'g7g5', 'h2h4', 'g5g4', 'f3e5', 'd8e7']	19732
C39	King's Gambit Accepted: Kieseritzky, Long Whip Defense, Jaenisch Variation	1. e4 e5 2. f4 exf4 3. Nf3 g5 4. h4 g4 5. Ne5 h5 6. Bc4 Rh7 7. d4 Bh6 8. Nc3	['e2e4', 'e7e5', 'f2f4', 'e5f4', 'g1f3', 'g7g5', 'h2h4', 'g5g4', 'f3e5', 'h7h5', 'f1c4', 'h8h7', 'd2d4', 'f8h6', 'b1c3']	1072
C39	King's Gambit Accepted: Kieseritzky, Polerio Defense	1. e4 e5 2. f4 exf4 3. Nf3 g5 4. h4 g4 5. Ne5 Be7	['e2e4', 'e7e5', 'f2f4', 'e5f4', 'g1f3', 'g7g5', 'h2h4', 'g5g4', 'f3e5', 'f8e7']	7750
C39	King's Gambit Accepted: Kieseritzky, Rice Gambit	1. e4 e5 2. f4 exf4 3. Nf3 g5 4. h4 g4 5. Ne5 Nf6 6. Bc4 d5 7. exd5 Bd6 8. O-O	['e2e4', 'e7e5', 'f2f4', 'e5f4', 'g1f3', 'g7g5', 'h2h4', 'g5g4', 'f3e5', 'g8f6', 'f1c4', 'd7d5', 'e4d5', 'f8d6', 'e1g1']	134
C39	King's Gambit Accepted: Kieseritzky, Salvio Defense, Cozio Variation	1. e4 e5 2. f4 exf4 3. Nf3 g5 4. h4 g4 5. Ne5 Qe7 6. d4 f5 7. Bc4	['e2e4', 'e7e5', 'f2f4', 'e5f4', 'g1f3', 'g7g5', 'h2h4', 'g5g4', 'f3e5', 'd8e7', 'd2d4', 'f7f5', 'f1c4']	51
C39	King's Gambit Accepted: King's Knight's Gambit	1. e4 e5 2. f4 exf4 3. Nf3 g5 4. h4	['e2e4', 'e7e5', 'f2f4', 'e5f4', 'g1f3', 'g7g5', 'h2h4']	850051
C40	Elephant Gambit	1. e4 e5 2. Nf3 d5	['e2e4', 'e7e5', 'g1f3', 'd7d5']	14128011
C40	Elephant Gambit: Maróczy Gambit	1. e4 e5 2. Nf3 d5 3. exd5 Bd6	['e2e4', 'e7e5', 'g1f3', 'd7d5', 'e4d5', 'f8d6']	266396
C40	Elephant Gambit: Paulsen Countergambit	1. e4 e5 2. Nf3 d5 3. exd5 e4	['e2e4', 'e7e5', 'g1f3', 'd7d5', 'e4d5', 'e5e4']	4098019
C40	Elephant Gambit: Wasp Variation	1. e4 e5 2. Nf3 d5 3. Nxe5 dxe4 4. Bc4 Qg5	['e2e4', 'e7e5', 'g1f3', 'd7d5', 'f3e5', 'd5e4', 'f1c4', 'd8g5']	36776
C40	Gunderam Defense	1. e4 e5 2. Nf3 Qe7	['e2e4', 'e7e5', 'g1f3', 'd8e7']	1772103
C40	King's Knight Opening	1. e4 e5 2. Nf3	['e2e4', 'e7e5', 'g1f3']	685445740
C40	King's Pawn Game: Busch-Gass Gambit	1. e4 e5 2. Nf3 Bc5	['e2e4', 'e7e5', 'g1f3', 'f8c5']	21103563
C40	King's Pawn Game: Busch-Gass Gambit, Chiodini Gambit	1. e4 e5 2. Nf3 Bc5 3. Nxe5 Nc6	['e2e4', 'e7e5', 'g1f3', 'f8c5', 'f3e5', 'b8c6']	230101
C40	King's Pawn Game: Damiano Defense	1. e4 e5 2. Nf3 f6	['e2e4', 'e7e5', 'g1f3', 'f7f6']	8640600
C40	King's Pawn Game: Damiano Defense, Damiano Gambit	1. e4 e5 2. Nf3 f6 3. Nxe5 fxe5 4. Qh5+ g6 5. Qxe5+ Qe7 6. Qxh8	['e2e4', 'e7e5', 'g1f3', 'f7f6', 'f3e5', 'f6e5', 'd1h5', 'g7g6', 'h5e5', 'd8e7', 'e5h8']	183432
C40	King's Pawn Game: Damiano Defense, Damiano Gambit, Chigorin Gambit	1. e4 e5 2. Nf3 f6 3. Nxe5 Qe7 4. Nf3 d5	['e2e4', 'e7e5', 'g1f3', 'f7f6', 'f3e5', 'd8e7', 'e5f3', 'd7d5']	4168
C40	King's Pawn Game: Gunderam Defense, Gunderam Gambit	1. e4 e5 2. Nf3 Qe7 3. Bc4 f5	['e2e4', 'e7e5', 'g1f3', 'd8e7', 'f1c4', 'f7f5']	7430
C40	King's Pawn Game: Gunderam Gambit	1. e4 e5 2. Nf3 c6	['e2e4', 'e7e5', 'g1f3', 'c7c6']	1956201
C40	King's Pawn Game: La Bourdonnais Gambit	1. e4 e5 2. Nf3 Qf6 3. Bc4 Qg6 4. O-O	['e2e4', 'e7e5', 'g1f3', 'd8f6', 'f1c4', 'f6g6', 'e1g1']	37920
C40	King's Pawn Game: McConnell Defense	1. e4 e5 2. Nf3 Qf6	['e2e4', 'e7e5', 'g1f3', 'd8f6']	14646574
C40	Latvian Gambit	1. e4 e5 2. Nf3 f5	['e2e4', 'e7e5', 'g1f3', 'f7f5']	6273642
C40	Latvian Gambit Accepted	1. e4 e5 2. Nf3 f5 3. exf5	['e2e4', 'e7e5', 'g1f3', 'f7f5', 'e4f5']	2418908
C40	Latvian Gambit Accepted: Bilguer Variation	1. e4 e5 2. Nf3 f5 3. Nxe5 Qf6 4. d4 d6 5. Nc4	['e2e4', 'e7e5', 'g1f3', 'f7f5', 'f3e5', 'd8f6', 'd2d4', 'd7d6', 'e5c4']	215083
C40	Latvian Gambit Accepted: Bronstein Attack	1. e4 e5 2. Nf3 f5 3. Nxe5 Qf6 4. d4 d6 5. Nc4 fxe4 6. Be2	['e2e4', 'e7e5', 'g1f3', 'f7f5', 'f3e5', 'd8f6', 'd2d4', 'd7d6', 'e5c4', 'f5e4', 'f1e2']	51736
C40	Latvian Gambit Accepted: Bronstein Gambit	1. e4 e5 2. Nf3 f5 3. Nxe5 Qf6 4. d4 d6 5. Nc4 fxe4 6. Qh5+ g6 7. Qe2	['e2e4', 'e7e5', 'g1f3', 'f7f5', 'f3e5', 'd8f6', 'd2d4', 'd7d6', 'e5c4', 'f5e4', 'd1h5', 'g7g6', 'h5e2']	578
C40	Latvian Gambit Accepted: Foltys Variation	1. e4 e5 2. Nf3 f5 3. Nxe5 Qf6 4. Nc4 fxe4 5. d3	['e2e4', 'e7e5', 'g1f3', 'f7f5', 'f3e5', 'd8f6', 'e5c4', 'f5e4', 'd2d3']	4431
C40	Latvian Gambit Accepted: Foltys-Leonhardt Variation	1. e4 e5 2. Nf3 f5 3. Nxe5 Qf6 4. Nc4	['e2e4', 'e7e5', 'g1f3', 'f7f5', 'f3e5', 'd8f6', 'e5c4']	46110
C40	Latvian Gambit Accepted: Leonhardt Variation	1. e4 e5 2. Nf3 f5 3. Nxe5 Qf6 4. Nc4 fxe4 5. Nc3	['e2e4', 'e7e5', 'g1f3', 'f7f5', 'f3e5', 'd8f6', 'e5c4', 'f5e4', 'b1c3']	19393
C40	Latvian Gambit Accepted: Main Line	1. e4 e5 2. Nf3 f5 3. Nxe5 Qf6 4. d4	['e2e4', 'e7e5', 'g1f3', 'f7f5', 'f3e5', 'd8f6', 'd2d4']	360767
C40	Latvian Gambit Accepted: Nimzowitsch Attack	1. e4 e5 2. Nf3 f5 3. Nxe5 Qf6 4. d4 d6 5. Nc4 fxe4 6. Ne3	['e2e4', 'e7e5', 'g1f3', 'f7f5', 'f3e5', 'd8f6', 'd2d4', 'd7d6', 'e5c4', 'f5e4', 'c4e3']	24089
C40	Latvian Gambit: Behting Variation	1. e4 e5 2. Nf3 f5 3. Bc4 fxe4 4. Nxe5 Qg5 5. Nf7 Qxg2 6. Rf1 d5 7. Nxh8 Nf6	['e2e4', 'e7e5', 'g1f3', 'f7f5', 'f1c4', 'f5e4', 'f3e5', 'd8g5', 'e5f7', 'g5g2', 'h1f1', 'd7d5', 'f7h8', 'g8f6']	2998
C40	Latvian Gambit: Corkscrew Countergambit	1. e4 e5 2. Nf3 f5 3. Bc4 fxe4 4. Nxe5 Nf6	['e2e4', 'e7e5', 'g1f3', 'f7f5', 'f1c4', 'f5e4', 'f3e5', 'g8f6']	44197
C40	Latvian Gambit: Corkscrew Gambit	1. e4 e5 2. Nf3 f5 3. Nxe5 Nf6 4. Bc4 fxe4 5. Nf7 Qe7 6. Nxh8 d5	['e2e4', 'e7e5', 'g1f3', 'f7f5', 'f3e5', 'g8f6', 'f1c4', 'f5e4', 'e5f7', 'd8e7', 'f7h8', 'd7d5']	23038
C40	Latvian Gambit: Diepstraten Countergambit	1. e4 e5 2. Nf3 f5 3. c4	['e2e4', 'e7e5', 'g1f3', 'f7f5', 'c2c4']	3106
C40	Latvian Gambit: Fraser Defense	1. e4 e5 2. Nf3 f5 3. Nxe5 Nc6	['e2e4', 'e7e5', 'g1f3', 'f7f5', 'f3e5', 'b8c6']	161499
C40	Latvian Gambit: Greco Variation	1. e4 e5 2. Nf3 f5 3. Nxe5 Qe7	['e2e4', 'e7e5', 'g1f3', 'f7f5', 'f3e5', 'd8e7']	73753
C40	Latvian Gambit: Lobster Gambit	1. e4 e5 2. Nf3 f5 3. g4	['e2e4', 'e7e5', 'g1f3', 'f7f5', 'g2g4']	567
C40	Latvian Gambit: Mason Countergambit	1. e4 e5 2. Nf3 f5 3. d4	['e2e4', 'e7e5', 'g1f3', 'f7f5', 'd2d4']	450324
C40	Latvian Gambit: Mayet Attack	1. e4 e5 2. Nf3 f5 3. Bc4	['e2e4', 'e7e5', 'g1f3', 'f7f5', 'f1c4']	570260
C40	Latvian Gambit: Mayet Attack, Morgado Defense	1. e4 e5 2. Nf3 f5 3. Bc4 Nf6	['e2e4', 'e7e5', 'g1f3', 'f7f5', 'f1c4', 'g8f6']	191744
C40	Latvian Gambit: Mayet Attack, Poisoned Pawn Variation	1. e4 e5 2. Nf3 f5 3. Bc4 fxe4 4. Nxe5 Qg5 5. d4 Qxg2	['e2e4', 'e7e5', 'g1f3', 'f7f5', 'f1c4', 'f5e4', 'f3e5', 'd8g5', 'd2d4', 'g5g2']	8594
C40	Latvian Gambit: Mayet Attack, Polerio-Svedenborg Variation	1. e4 e5 2. Nf3 f5 3. Bc4 fxe4 4. Nxe5 d5	['e2e4', 'e7e5', 'g1f3', 'f7f5', 'f1c4', 'f5e4', 'f3e5', 'd7d5']	95230
C40	Latvian Gambit: Mayet Attack, Strautins Gambit	1. e4 e5 2. Nf3 f5 3. Bc4 b5	['e2e4', 'e7e5', 'g1f3', 'f7f5', 'f1c4', 'b7b5']	3036
C40	Latvian Gambit: Mlotkowski Variation	1. e4 e5 2. Nf3 f5 3. Nc3	['e2e4', 'e7e5', 'g1f3', 'f7f5', 'b1c3']	917829
C40	Latvian Gambit: Senechaud Gambit	1. e4 e5 2. Nf3 f5 3. b4	['e2e4', 'e7e5', 'g1f3', 'f7f5', 'b2b4']	112
C41	Philidor Defense	1. e4 e5 2. Nf3 d6	['e2e4', 'e7e5', 'g1f3', 'd7d6']	104291573
C41	Philidor Defense	1. e4 e5 2. Nf3 d6 3. d4	['e2e4', 'e7e5', 'g1f3', 'd7d6', 'd2d4']	32810853
C41	Philidor Defense	1. e4 e5 2. Nf3 d6 3. Bc4	['e2e4', 'e7e5', 'g1f3', 'd7d6', 'f1c4']	47205906
C41	Philidor Defense	1. e4 e5 2. Nf3 d6 3. Bc4 Be7	['e2e4', 'e7e5', 'g1f3', 'd7d6', 'f1c4', 'f8e7']	6526292
C41	Philidor Defense: Albin-Blackburne Gambit	1. e4 e5 2. Nf3 d6 3. d4 Bg4 4. dxe5 Nd7	['e2e4', 'e7e5', 'g1f3', 'd7d6', 'd2d4', 'c8g4', 'd4e5', 'b8d7']	93151
C41	Philidor Defense: Berger Variation	1. e4 e5 2. Nf3 d6 3. d4 exd4 4. Nxd4 Nf6 5. Nc3 Be7 6. Be2 O-O 7. O-O c5 8. Nf3 Nc6 9. Bg5 Be6 10. Re1	['e2e4', 'e7e5', 'g1f3', 'd7d6', 'd2d4', 'e5d4', 'f3d4', 'g8f6', 'b1c3', 'f8e7', 'f1e2', 'e8g8', 'e1g1', 'c7c5', 'd4f3', 'b8c6', 'c1g5', 'c8e6', 'f1e1']	353
C41	Philidor Defense: Bird Gambit	1. e4 e5 2. Nf3 d6 3. d4 exd4 4. c3	['e2e4', 'e7e5', 'g1f3', 'd7d6', 'd2d4', 'e5d4', 'c2c3']	548657
C41	Philidor Defense: Boden Variation	1. e4 e5 2. Nf3 d6 3. d4 exd4 4. Qxd4 Bd7	['e2e4', 'e7e5', 'g1f3', 'd7d6', 'd2d4', 'e5d4', 'd1d4', 'c8d7']	64232
C41	Philidor Defense: Exchange Variation	1. e4 e5 2. Nf3 d6 3. d4 exd4	['e2e4', 'e7e5', 'g1f3', 'd7d6', 'd2d4', 'e5d4']	16086163
C41	Philidor Defense: Exchange Variation	1. e4 e5 2. Nf3 d6 3. d4 exd4 4. Nxd4	['e2e4', 'e7e5', 'g1f3', 'd7d6', 'd2d4', 'e5d4', 'f3d4']	12184398
C41	Philidor Defense: Exchange Variation	1. e4 e5 2. Nf3 d6 3. d4 exd4 4. Nxd4 Nf6	['e2e4', 'e7e5', 'g1f3', 'd7d6', 'd2d4', 'e5d4', 'f3d4', 'g8f6']	4429645
C41	Philidor Defense: Hanham Variation	1. e4 e5 2. Nf3 d6 3. d4 Nd7	['e2e4', 'e7e5', 'g1f3', 'd7d6', 'd2d4', 'b8d7']	1812963
C41	Philidor Defense: Hanham Variation, Delmar Variation	1. e4 e5 2. Nf3 d6 3. d4 Nd7 4. Bc4 c6 5. c3	['e2e4', 'e7e5', 'g1f3', 'd7d6', 'd2d4', 'b8d7', 'f1c4', 'c7c6', 'c2c3']	39870
C41	Philidor Defense: Hanham Variation, Krause Variation	1. e4 e5 2. Nf3 d6 3. d4 Nd7 4. Bc4 c6 5. O-O	['e2e4', 'e7e5', 'g1f3', 'd7d6', 'd2d4', 'b8d7', 'f1c4', 'c7c6', 'e1g1']	67490
C41	Philidor Defense: Hanham Variation, Schlechter Variation	1. e4 e5 2. Nf3 d6 3. d4 Nd7 4. Bc4 c6 5. Nc3	['e2e4', 'e7e5', 'g1f3', 'd7d6', 'd2d4', 'b8d7', 'f1c4', 'c7c6', 'b1c3']	123973
C41	Philidor Defense: Hanham Variation, Sharp Variation	1. e4 e5 2. Nf3 d6 3. d4 Nd7 4. Bc4 Nb6	['e2e4', 'e7e5', 'g1f3', 'd7d6', 'd2d4', 'b8d7', 'f1c4', 'd7b6']	8651
C41	Philidor Defense: Hanham Variation, Steiner Variation	1. e4 e5 2. Nf3 d6 3. d4 Nd7 4. Bc4 c6 5. O-O Be7 6. dxe5	['e2e4', 'e7e5', 'g1f3', 'd7d6', 'd2d4', 'b8d7', 'f1c4', 'c7c6', 'e1g1', 'f8e7', 'd4e5']	27047
C41	Philidor Defense: Hanham, Kmoch Variation	1. e4 e5 2. Nf3 d6 3. d4 Nd7 4. Bc4 c6 5. Ng5	['e2e4', 'e7e5', 'g1f3', 'd7d6', 'd2d4', 'b8d7', 'f1c4', 'c7c6', 'f3g5']	21185
C41	Philidor Defense: Larsen Variation	1. e4 e5 2. Nf3 d6 3. d4 exd4 4. Nxd4 g6	['e2e4', 'e7e5', 'g1f3', 'd7d6', 'd2d4', 'e5d4', 'f3d4', 'g7g6']	409807
C41	Philidor Defense: Lion Variation	1. e4 e5 2. Nf3 d6 3. d4 Nf6 4. Nc3 Nbd7	['e2e4', 'e7e5', 'g1f3', 'd7d6', 'd2d4', 'g8f6', 'b1c3', 'b8d7']	1778586
C41	Philidor Defense: Lion Variation, Bishop Sacrifice	1. e4 e5 2. Nf3 d6 3. d4 Nf6 4. Nc3 Nbd7 5. Bc4 Be7 6. Bxf7+	['e2e4', 'e7e5', 'g1f3', 'd7d6', 'd2d4', 'g8f6', 'b1c3', 'b8d7', 'f1c4', 'f8e7', 'c4f7']	38344
C41	Philidor Defense: Lion Variation, Delayed Bishop Sacrifice	1. e4 d6 2. d4 Nf6 3. Nc3 Nbd7 4. Nf3 e5 5. Bc4 Be7 6. dxe5 dxe5 7. Bxf7+	['e2e4', 'd7d6', 'd2d4', 'g8f6', 'b1c3', 'b8d7', 'g1f3', 'e7e5', 'f1c4', 'f8e7', 'd4e5', 'd6e5', 'c4f7']	16073
C41	Philidor Defense: Lion Variation, Forcing Line	1. e4 e5 2. Nf3 d6 3. d4 Nf6 4. Nc3 Nbd7 5. Bc4 Be7 6. Ng5 O-O 7. Bxf7+ Rxf7 8. Ne6	['e2e4', 'e7e5', 'g1f3', 'd7d6', 'd2d4', 'g8f6', 'b1c3', 'b8d7', 'f1c4', 'f8e7', 'f3g5', 'e8g8', 'c4f7', 'f8f7', 'g5e6']	10845
C41	Philidor Defense: Lion Variation, Lion's Claw, with Bc4 and h6	1. e4 e5 2. Nf3 d6 3. d4 Nf6 4. Nc3 Nbd7 5. Bc4 Be7 6. O-O h6	['e2e4', 'e7e5', 'g1f3', 'd7d6', 'd2d4', 'g8f6', 'b1c3', 'b8d7', 'f1c4', 'f8e7', 'e1g1', 'h7h6']	60910
C41	Philidor Defense: Lion Variation, Lion's Claw, with Be2 and c6	1. e4 e5 2. Nf3 d6 3. d4 Nf6 4. Nc3 Nbd7 5. Be2 Be7 6. O-O c6	['e2e4', 'e7e5', 'g1f3', 'd7d6', 'd2d4', 'g8f6', 'b1c3', 'b8d7', 'f1e2', 'f8e7', 'e1g1', 'c7c6']	24900
C41	Philidor Defense: Lion Variation, Shirov Gambit	1. e4 e5 2. Nf3 d6 3. d4 Nd7 4. Nc3 Ngf6 5. g4	['e2e4', 'e7e5', 'g1f3', 'd7d6', 'd2d4', 'b8d7', 'b1c3', 'g8f6', 'g2g4']	38073
C41	Philidor Defense: Lion Variation, Sozin Variation	1. e4 d6 2. d4 Nf6 3. Nc3 e5 4. Nf3 Nbd7 5. Bc4 Be7 6. O-O O-O 7. Qe2 c6 8. a4 exd4	['e2e4', 'd7d6', 'd2d4', 'g8f6', 'b1c3', 'e7e5', 'g1f3', 'b8d7', 'f1c4', 'f8e7', 'e1g1', 'e8g8', 'd1e2', 'c7c6', 'a2a4', 'e5d4']	1160
C41	Philidor Defense: Lopez Countergambit	1. e4 e5 2. Nf3 d6 3. Bc4 f5	['e2e4', 'e7e5', 'g1f3', 'd7d6', 'f1c4', 'f7f5']	1336434
C41	Philidor Defense: Lopez Countergambit, Jaenisch Variation	1. e4 e5 2. Nf3 d6 3. d4 f5 4. Bc4 exd4 5. Ng5 Nh6 6. Nxh7	['e2e4', 'e7e5', 'g1f3', 'd7d6', 'd2d4', 'f7f5', 'f1c4', 'e5d4', 'f3g5', 'g8h6', 'g5h7']	15
C41	Philidor Defense: Morphy Gambit	1. e4 e5 2. Nf3 d6 3. d4 exd4 4. Bc4	['e2e4', 'e7e5', 'g1f3', 'd7d6', 'd2d4', 'e5d4', 'f1c4']	1123542
C41	Philidor Defense: Nimzowitsch Variation	1. e4 e5 2. Nf3 d6 3. d4 Nf6	['e2e4', 'e7e5', 'g1f3', 'd7d6', 'd2d4', 'g8f6']	2151571
C41	Philidor Defense: Nimzowitsch Variation	1. e4 e5 2. Nf3 d6 3. d4 Nf6 4. dxe5	['e2e4', 'e7e5', 'g1f3', 'd7d6', 'd2d4', 'g8f6', 'd4e5']	1424689
C41	Philidor Defense: Nimzowitsch Variation, Klein Variation	1. e4 e5 2. Nf3 d6 3. d4 Nf6 4. Bc4	['e2e4', 'e7e5', 'g1f3', 'd7d6', 'd2d4', 'g8f6', 'f1c4']	722258
C41	Philidor Defense: Nimzowitsch Variation, Rellstab Variation	1. e4 e5 2. Nf3 d6 3. d4 Nf6 4. dxe5 Nxe4 5. Qd5	['e2e4', 'e7e5', 'g1f3', 'd7d6', 'd2d4', 'g8f6', 'd4e5', 'f6e4', 'd1d5']	29372
C41	Philidor Defense: Nimzowitsch Variation, Sokolsky Variation	1. e4 e5 2. Nf3 d6 3. d4 Nf6 4. dxe5 Nxe4 5. Nbd2	['e2e4', 'e7e5', 'g1f3', 'd7d6', 'd2d4', 'g8f6', 'd4e5', 'f6e4', 'b1d2']	4035
C41	Philidor Defense: Nimzowitsch, Larobok Variation	1. e4 e5 2. Nf3 d6 3. d4 Nf6 4. Nc3 Nbd7 5. Bc4 Be7 6. Ng5 O-O 7. Bxf7+	['e2e4', 'e7e5', 'g1f3', 'd7d6', 'd2d4', 'g8f6', 'b1c3', 'b8d7', 'f1c4', 'f8e7', 'f3g5', 'e8g8', 'c4f7']	11311
C41	Philidor Defense: Nimzowitsch, Locock Variation	1. e4 e5 2. Nf3 d6 3. d4 Nf6 4. Ng5	['e2e4', 'e7e5', 'g1f3', 'd7d6', 'd2d4', 'g8f6', 'f3g5']	8454
C41	Philidor Defense: Paulsen Attack	1. e4 e5 2. Nf3 d6 3. d4 exd4 4. Nxd4 d5 5. exd5	['e2e4', 'e7e5', 'g1f3', 'd7d6', 'd2d4', 'e5d4', 'f3d4', 'd6d5', 'e4d5']	53334
C41	Philidor Defense: Philidor Countergambit	1. e4 e5 2. Nf3 d6 3. d4 f5	['e2e4', 'e7e5', 'g1f3', 'd7d6', 'd2d4', 'f7f5']	753288
C41	Philidor Defense: Philidor Countergambit, Berger Variation	1. e4 e5 2. Nf3 d6 3. d4 f5 4. dxe5 fxe4 5. Ng5 d5 6. e6 Bc5 7. Nc3	['e2e4', 'e7e5', 'g1f3', 'd7d6', 'd2d4', 'f7f5', 'd4e5', 'f5e4', 'f3g5', 'd6d5', 'e5e6', 'f8c5', 'b1c3']	315
C41	Philidor Defense: Philidor Countergambit, Zukertort Variation	1. e4 e5 2. Nf3 d6 3. d4 f5 4. Nc3	['e2e4', 'e7e5', 'g1f3', 'd7d6', 'd2d4', 'f7f5', 'b1c3']	285540
C41	Philidor Defense: Philidor Countergambit, del Rio Attack	1. e4 e5 2. Nf3 d6 3. d4 f5 4. dxe5 fxe4 5. Ng5 d5 6. e6	['e2e4', 'e7e5', 'g1f3', 'd7d6', 'd2d4', 'f7f5', 'd4e5', 'f5e4', 'f3g5', 'd6d5', 'e5e6']	22272
C41	Philidor Defense: Philidor Gambit	1. e4 e5 2. Nf3 d6 3. d4 Bd7	['e2e4', 'e7e5', 'g1f3', 'd7d6', 'd2d4', 'c8d7']	106695
C41	Philidor Defense: Steinitz Variation	1. e4 e5 2. Nf3 d6 3. Bc4 Be7 4. c3	['e2e4', 'e7e5', 'g1f3', 'd7d6', 'f1c4', 'f8e7', 'c2c3']	886409
C42	Russian Game	1. e4 e5 2. Nf3 Nf6	['e2e4', 'e7e5', 'g1f3', 'g8f6']	87757662
C42	Russian Game	1. e4 e5 2. Nf3 Nf6 3. Nxe5	['e2e4', 'e7e5', 'g1f3', 'g8f6', 'f3e5']	28364692
C42	Russian Game	1. e4 e5 2. Nf3 Nf6 3. Nxe5 d6	['e2e4', 'e7e5', 'g1f3', 'g8f6', 'f3e5', 'd7d6']	7592266
C42	Russian Game	1. e4 e5 2. Nf3 Nf6 3. Nxe5 d6 4. Nf3	['e2e4', 'e7e5', 'g1f3', 'g8f6', 'f3e5', 'd7d6', 'e5f3']	6252482
C42	Russian Game	1. e4 e5 2. Nf3 Nf6 3. Nxe5 d6 4. Nf3 Nxe4	['e2e4', 'e7e5', 'g1f3', 'g8f6', 'f3e5', 'd7d6', 'e5f3', 'f6e4']	5778722
C42	Russian Game: Classical Attack	1. e4 e5 2. Nf3 Nf6 3. Nxe5 d6 4. Nf3 Nxe4 5. d4	['e2e4', 'e7e5', 'g1f3', 'g8f6', 'f3e5', 'd7d6', 'e5f3', 'f6e4', 'd2d4']	1430085
C42	Russian Game: Classical Attack, Berger Variation	1. e4 e5 2. Nf3 Nf6 3. Nxe5 d6 4. Nf3 Nxe4 5. d4 d5 6. Bd3 Be7 7. O-O Nc6 8. Re1 Bg4 9. c3 f5 10. Nbd2	['e2e4', 'e7e5', 'g1f3', 'g8f6', 'f3e5', 'd7d6', 'e5f3', 'f6e4', 'd2d4', 'd6d5', 'f1d3', 'f8e7', 'e1g1', 'b8c6', 'f1e1', 'c8g4', 'c2c3', 'f7f5', 'b1d2']	2628
C42	Russian Game: Classical Attack, Chigorin Variation	1. e4 e5 2. Nf3 Nf6 3. Nxe5 d6 4. Nf3 Nxe4 5. d4 d5 6. Bd3 Be7 7. O-O Nc6 8. Re1	['e2e4', 'e7e5', 'g1f3', 'g8f6', 'f3e5', 'd7d6', 'e5f3', 'f6e4', 'd2d4', 'd6d5', 'f1d3', 'f8e7', 'e1g1', 'b8c6', 'f1e1']	37268
C42	Russian Game: Classical Attack, Chigorin Variation, Browne Attack	1. e4 e5 2. Nf3 Nf6 3. Nxe5 d6 4. Nf3 Nxe4 5. d4 d5 6. Bd3 Nc6 7. O-O Be7 8. c4 Nb4 9. cxd5	['e2e4', 'e7e5', 'g1f3', 'g8f6', 'f3e5', 'd7d6', 'e5f3', 'f6e4', 'd2d4', 'd6d5', 'f1d3', 'b8c6', 'e1g1', 'f8e7', 'c2c4', 'c6b4', 'c4d5']	9210
C42	Russian Game: Classical Attack, Chigorin Variation, Main Line	1. e4 e5 2. Nf3 Nf6 3. Nxe5 d6 4. Nf3 Nxe4 5. d4 d5 6. Bd3 Nc6 7. O-O Be7 8. c4 Nb4 9. Be2	['e2e4', 'e7e5', 'g1f3', 'g8f6', 'f3e5', 'd7d6', 'e5f3', 'f6e4', 'd2d4', 'd6d5', 'f1d3', 'b8c6', 'e1g1', 'f8e7', 'c2c4', 'c6b4', 'd3e2']	12206
C42	Russian Game: Classical Attack, Closed Variation	1. e4 e5 2. Nf3 Nf6 3. Nxe5 d6 4. Nf3 Nxe4 5. d4 Nf6	['e2e4', 'e7e5', 'g1f3', 'g8f6', 'f3e5', 'd7d6', 'e5f3', 'f6e4', 'd2d4', 'e4f6']	135158
C42	Russian Game: Classical Attack, Jaenisch Variation	1. e4 e5 2. Nf3 Nf6 3. Nxe5 d6 4. Nf3 Nxe4 5. d4 d5 6. Bd3 Nc6 7. O-O Be7 8. c4	['e2e4', 'e7e5', 'g1f3', 'g8f6', 'f3e5', 'd7d6', 'e5f3', 'f6e4', 'd2d4', 'd6d5', 'f1d3', 'b8c6', 'e1g1', 'f8e7', 'c2c4']	44938
C42	Russian Game: Classical Attack, Krause Variation	1. e4 e5 2. Nf3 Nf6 3. Nxe5 d6 4. Nf3 Nxe4 5. d4 d5 6. Bd3 Nc6 7. O-O Be7 8. Re1 Bg4 9. c3 f5 10. c4	['e2e4', 'e7e5', 'g1f3', 'g8f6', 'f3e5', 'd7d6', 'e5f3', 'f6e4', 'd2d4', 'd6d5', 'f1d3', 'b8c6', 'e1g1', 'f8e7', 'f1e1', 'c8g4', 'c2c3', 'f7f5', 'c3c4']	75
C42	Russian Game: Classical Attack, Marshall Trap	1. e4 e5 2. Nf3 Nf6 3. Nxe5 d6 4. Nf3 Nxe4 5. d4 d5 6. Bd3 Bd6 7. O-O O-O 8. c4 Bg4 9. cxd5 f5 10. Re1 Bxh2+	['e2e4', 'e7e5', 'g1f3', 'g8f6', 'f3e5', 'd7d6', 'e5f3', 'f6e4', 'd2d4', 'd6d5', 'f1d3', 'f8d6', 'e1g1', 'e8g8', 'c2c4', 'c8g4', 'c4d5', 'f7f5', 'f1e1', 'd6h2']	715
C42	Russian Game: Classical Attack, Marshall Variation	1. e4 e5 2. Nf3 Nf6 3. Nxe5 d6 4. Nf3 Nxe4 5. d4 d5 6. Bd3 Bd6	['e2e4', 'e7e5', 'g1f3', 'g8f6', 'f3e5', 'd7d6', 'e5f3', 'f6e4', 'd2d4', 'd6d5', 'f1d3', 'f8d6']	303711
C42	Russian Game: Classical Attack, Marshall Variation, Chinese Gambit	1. e4 e5 2. Nf3 Nf6 3. Nxe5 d6 4. Nf3 Nxe4 5. d4 d5 6. Bd3 Bd6 7. O-O O-O 8. c4 c6 9. Re1 Bg4	['e2e4', 'e7e5', 'g1f3', 'g8f6', 'f3e5', 'd7d6', 'e5f3', 'f6e4', 'd2d4', 'd6d5', 'f1d3', 'f8d6', 'e1g1', 'e8g8', 'c2c4', 'c7c6', 'f1e1', 'c8g4']	2258
C42	Russian Game: Classical Attack, Maróczy Variation	1. e4 e5 2. Nf3 Nf6 3. Nxe5 d6 4. Nf3 Nxe4 5. d4 d5 6. Bd3 Be7 7. O-O Nc6 8. Re1 Bg4 9. c3 f5 10. c4 Bh4	['e2e4', 'e7e5', 'g1f3', 'g8f6', 'f3e5', 'd7d6', 'e5f3', 'f6e4', 'd2d4', 'd6d5', 'f1d3', 'f8e7', 'e1g1', 'b8c6', 'f1e1', 'c8g4', 'c2c3', 'f7f5', 'c3c4', 'e7h4']	1
C42	Russian Game: Classical Attack, Mason Variation	1. e4 e5 2. Nf3 Nf6 3. Nxe5 d6 4. Nf3 Nxe4 5. d4 d5 6. Bd3 Be7 7. O-O O-O	['e2e4', 'e7e5', 'g1f3', 'g8f6', 'f3e5', 'd7d6', 'e5f3', 'f6e4', 'd2d4', 'd6d5', 'f1d3', 'f8e7', 'e1g1', 'e8g8']	92232
C42	Russian Game: Classical Attack, Mason-Showalter Variation	1. e4 e5 2. Nf3 Nf6 3. Nxe5 d6 4. Nf3 Nxe4 5. d4 d5 6. Bd3 Nc6	['e2e4', 'e7e5', 'g1f3', 'g8f6', 'f3e5', 'd7d6', 'e5f3', 'f6e4', 'd2d4', 'd6d5', 'f1d3', 'b8c6']	135488
C42	Russian Game: Classical Attack, Staunton Variation	1. e4 e5 2. Nf3 Nf6 3. Nxe5 d6 4. Nf3 Nxe4 5. d4 d5 6. Bd3 Bd6 7. O-O O-O 8. c4 c6	['e2e4', 'e7e5', 'g1f3', 'g8f6', 'f3e5', 'd7d6', 'e5f3', 'f6e4', 'd2d4', 'd6d5', 'f1d3', 'f8d6', 'e1g1', 'e8g8', 'c2c4', 'c7c6']	114729
C42	Russian Game: Classical Attack, Tarrasch Variation	1. e4 e5 2. Nf3 Nf6 3. Nxe5 d6 4. Nf3 Nxe4 5. d4 d5 6. Bd3 Bd6 7. O-O O-O 8. c4 Bg4	['e2e4', 'e7e5', 'g1f3', 'g8f6', 'f3e5', 'd7d6', 'e5f3', 'f6e4', 'd2d4', 'd6d5', 'f1d3', 'f8d6', 'e1g1', 'e8g8', 'c2c4', 'c8g4']	1907
C42	Russian Game: Cochrane Gambit	1. e4 e5 2. Nf3 Nf6 3. Nxe5 d6 4. Nxf7	['e2e4', 'e7e5', 'g1f3', 'g8f6', 'f3e5', 'd7d6', 'e5f7']	582786
C42	Russian Game: Cochrane Gambit, Bishop Check Line	1. e4 e5 2. Nf3 Nf6 3. Nxe5 d6 4. Nxf7 Kxf7 5. Bc4+	['e2e4', 'e7e5', 'g1f3', 'g8f6', 'f3e5', 'd7d6', 'e5f7', 'e8f7', 'f1c4']	282836
C42	Russian Game: Cochrane Gambit, Center Variation	1. e4 e5 2. Nf3 Nf6 3. Nxe5 d6 4. Nxf7 Kxf7 5. d4	['e2e4', 'e7e5', 'g1f3', 'g8f6', 'f3e5', 'd7d6', 'e5f7', 'e8f7', 'd2d4']	169929
C42	Russian Game: Cozio Attack	1. e4 e5 2. Nf3 Nf6 3. Nxe5 d6 4. Nf3 Nxe4 5. Qe2	['e2e4', 'e7e5', 'g1f3', 'g8f6', 'f3e5', 'd7d6', 'e5f3', 'f6e4', 'd1e2']	1906035
C42	Russian Game: Damiano Variation	1. e4 e5 2. Nf3 Nf6 3. Nxe5 Nxe4	['e2e4', 'e7e5', 'g1f3', 'g8f6', 'f3e5', 'f6e4']	5382556
C42	Russian Game: Damiano Variation, Kholmov Gambit	1. e4 e5 2. Nf3 Nf6 3. Nxe5 Nxe4 4. Qe2 Qe7	['e2e4', 'e7e5', 'g1f3', 'g8f6', 'f3e5', 'f6e4', 'd1e2', 'd8e7']	794873
C42	Russian Game: French Attack	1. e4 e5 2. Nf3 Nf6 3. Nxe5 d6 4. Nf3 Nxe4 5. d3	['e2e4', 'e7e5', 'g1f3', 'g8f6', 'f3e5', 'd7d6', 'e5f3', 'f6e4', 'd2d3']	755559
C42	Russian Game: Italian Variation	1. e4 e5 2. Nf3 Nf6 3. Bc4	['e2e4', 'e7e5', 'g1f3', 'g8f6', 'f1c4']	26860861
C42	Russian Game: Karklins-Martinovsky Variation	1. e4 e5 2. Nf3 Nf6 3. Nxe5 d6 4. Nd3	['e2e4', 'e7e5', 'g1f3', 'g8f6', 'f3e5', 'd7d6', 'e5d3']	211374
C42	Russian Game: Kaufmann Attack	1. e4 e5 2. Nf3 Nf6 3. Nxe5 d6 4. Nf3 Nxe4 5. c4	['e2e4', 'e7e5', 'g1f3', 'g8f6', 'f3e5', 'd7d6', 'e5f3', 'f6e4', 'c2c4']	37537
C42	Russian Game: Millennium Attack	1. e4 e5 2. Nf3 Nf6 3. Nxe5 d6 4. Nf3 Nxe4 5. Bd3	['e2e4', 'e7e5', 'g1f3', 'g8f6', 'f3e5', 'd7d6', 'e5f3', 'f6e4', 'f1d3']	177411
C42	Russian Game: Moody Gambit	1. e4 e5 2. Nf3 Nf6 3. Qe2 Nc6 4. d4	['e2e4', 'e7e5', 'g1f3', 'g8f6', 'd1e2', 'b8c6', 'd2d4']	26567
C42	Russian Game: Nimzowitsch Attack	1. e4 e5 2. Nf3 Nf6 3. Nxe5 d6 4. Nf3 Nxe4 5. Nc3	['e2e4', 'e7e5', 'g1f3', 'g8f6', 'f3e5', 'd7d6', 'e5f3', 'f6e4', 'b1c3']	1059421
C42	Russian Game: Paulsen Attack	1. e4 e5 2. Nf3 Nf6 3. Nxe5 d6 4. Nc4	['e2e4', 'e7e5', 'g1f3', 'g8f6', 'f3e5', 'd7d6', 'e5c4']	346952
C42	Russian Game: Stafford Gambit	1. e4 e5 2. Nf3 Nf6 3. Nxe5 Nc6	['e2e4', 'e7e5', 'g1f3', 'g8f6', 'f3e5', 'b8c6']	9980931
C42	Russian Game: Stafford Gambit	1. e4 e5 2. Nf3 Nf6 3. Nxe5 Nc6 4. Nxc6 dxc6	['e2e4', 'e7e5', 'g1f3', 'g8f6', 'f3e5', 'b8c6', 'e5c6', 'd7c6']	8062329
C42	Russian Game: Three Knights Game	1. e4 e5 2. Nf3 Nf6 3. Nc3	['e2e4', 'e7e5', 'g1f3', 'g8f6', 'b1c3']	36998975
C43	Bishop's Opening: Urusov Gambit	1. e4 e5 2. Bc4 Nf6 3. d4 exd4 4. Nf3	['e2e4', 'e7e5', 'f1c4', 'g8f6', 'd2d4', 'e5d4', 'g1f3']	1037751
C43	Bishop's Opening: Urusov Gambit, Keidansky Gambit	1. e4 e5 2. Bc4 Nf6 3. d4 exd4 4. Nf3 Nxe4 5. Qxd4	['e2e4', 'e7e5', 'f1c4', 'g8f6', 'd2d4', 'e5d4', 'g1f3', 'f6e4', 'd1d4']	197195
C43	Russian Game: Modern Attack	1. e4 e5 2. Nf3 Nf6 3. d4	['e2e4', 'e7e5', 'g1f3', 'g8f6', 'd2d4']	6503143
C43	Russian Game: Modern Attack	1. e4 e5 2. Nf3 Nf6 3. d4 exd4	['e2e4', 'e7e5', 'g1f3', 'g8f6', 'd2d4', 'e5d4']	3380694
C43	Russian Game: Modern Attack, Bardeleben Variation	1. e4 e5 2. Nf3 Nf6 3. d4 exd4 4. e5 Ne4 5. Qe2 Nc5 6. Nxd4 Nc6	['e2e4', 'e7e5', 'g1f3', 'g8f6', 'd2d4', 'e5d4', 'e4e5', 'f6e4', 'd1e2', 'e4c5', 'f3d4', 'b8c6']	391
C43	Russian Game: Modern Attack, Center Attack	1. e4 e5 2. Nf3 Nf6 3. d4 exd4 4. e5 Ne4 5. Qxd4	['e2e4', 'e7e5', 'g1f3', 'g8f6', 'd2d4', 'e5d4', 'e4e5', 'f6e4', 'd1d4']	141744
