eco	name	pgn	uci_moves	games
A00	Amar Gambit	1. Nh3 d5 2. g3 e5 3. f4 Bxh3 4. Bxh3 exf4	['g1h3', 'd7d5', 'g2g3', 'e7e5', 'f2f4', 'c8h3', 'f1h3', 'e5f4']	2025
A00	Amar Opening	1. Nh3	['g1h3']	1531792
A00	Amar Opening: Gent Gambit	1. Nh3 d5 2. g3 e5 3. f4 Bxh3 4. Bxh3 exf4 5. O-O fxg3 6. hxg3	['g1h3', 'd7d5', 'g2g3', 'e7e5', 'f2f4', 'c8h3', 'f1h3', 'e5f4', 'e1g1', 'f4g3', 'h2g3']	212
A00	Amar Opening: Paris Gambit	1. Nh3 d5 2. g3 e5 3. f4	['g1h3', 'd7d5', 'g2g3', 'e7e5', 'f2f4']	15845
A00	Amsterdam Attack	1. e3 e5 2. c4 d6 3. Nc3 Nc6 4. b3 Nf6	['e2e3', 'e7e5', 'c2c4', 'd7d6', 'b1c3', 'b8c6', 'b2b3', 'g8f6']	9657
A00	Anderssen's Opening	1. a3	['a2a3']	4513275
A00	Anderssen's Opening: Polish Gambit	1. a3 a5 2. b4	['a2a3', 'a7a5', 'b2b4']	16810
A00	Barnes Opening	1. f3	['f2f3']	6338367
A00	Barnes Opening: Fool's Mate	1. f3 e5 2. g4 Qh4#	['f2f3', 'e7e5', 'g2g4', 'd8h4']	0
A00	Barnes Opening: Gedult Gambit	1. f3 d5 2. e4 g6 3. d4 dxe4 4. c3	['f2f3', 'd7d5', 'e2e4', 'g7g6', 'd2d4', 'd5e4', 'c2c3']	2724
A00	Barnes Opening: Gedult Gambit	1. f3 f5 2. e4 fxe4 3. Nc3	['f2f3', 'f7f5', 'e2e4', 'f5e4', 'b1c3']	7435
A00	Barnes Opening: Hammerschlag	1. f3 e5 2. Kf2	['f2f3', 'e7e5', 'e1f2']	256804
A00	Clemenz Opening	1. h3	['h2h3']	3513736
A00	Clemenz Opening: Spike Lee Gambit	1. h3 h5 2. g4	['h2h3', 'h7h5', 'g2g4']	8746
A00	Crab Opening	1. a4 e5 2. h4	['a2a4', 'e7e5', 'h2h4']	361973
A00	Creepy Crawly Formation: Classical Defense	1. h3 d5 2. a3 e5	['h2h3', 'd7d5', 'a2a3', 'e7e5']	414090
A00	Formation: Hippopotamus Attack	1. a3 e5 2. b3 d5 3. c3 Nf6 4. d3 Nc6 5. e3 Bd6 6. f3 O-O 7. g3	['a2a3', 'e7e5', 'b2b3', 'd7d5', 'c2c3', 'g8f6', 'd2d3', 'b8c6', 'e2e3', 'f8d6', 'f2f3', 'e8g8', 'g2g3']	2300
A00	Formation: Shy Attack	1. a3 e5 2. g3 d5 3. Bg2 Nf6 4. d3 Nc6 5. Nd2 Bd6 6. e3 O-O 7. h3	['a2a3', 'e7e5', 'g2g3', 'd7d5', 'f1g2', 'g8f6', 'd2d3', 'b8c6', 'b1d2', 'f8d6', 'e2e3', 'e8g8', 'h2h3']	737
A00	Global Opening	1. h3 e5 2. a3	['h2h3', 'e7e5', 'a2a3']	516671
A00	Grob Opening	1. g4	['g2g4']	12881189
A00	Grob Opening: Alessi Gambit	1. g4 f5	['g2g4', 'f7f5']	58640
A00	Grob Opening: Double Grob	1. g4 g5	['g2g4', 'g7g5']	142051
A00	Grob Opening: Double Grob, Coca-Cola Gambit	1. g4 g5 2. f4	['g2g4', 'g7g5', 'f2f4']	4895
A00	Grob Opening: Grob Gambit	1. g4 d5 2. Bg2	['g2g4', 'd7d5', 'f1g2']	3242284
A00	Grob Opening: Grob Gambit Declined	1. g4 d5 2. Bg2 c6	['g2g4', 'd7d5', 'f1g2', 'c7c6']	898086
A00	Grob Opening: Grob Gambit, Basman Gambit	1. g4 d5 2. Bg2 h5 3. gxh5	['g2g4', 'd7d5', 'f1g2', 'h7h5', 'g4h5']	4411
A00	Grob Opening: Grob Gambit, Fritz Gambit	1. g4 d5 2. Bg2 Bxg4 3. c4	['g2g4', 'd7d5', 'f1g2', 'c8g4', 'c2c4']	1179118
A00	Grob Opening: Grob Gambit, Fritz Gambit, Romford Countergambit	1. g4 d5 2. Bg2 Bxg4 3. c4 d4 4. Bxb7 Nd7 5. Bxa8 Qxa8	['g2g4', 'd7d5', 'f1g2', 'c8g4', 'c2c4', 'd5d4', 'g2b7', 'b8d7', 'b7a8', 'd8a8']	9416
A00	Grob Opening: Grob Gambit, Keres Gambit	1. g4 d5 2. Bg2 e5 3. d4 exd4 4. c3	['g2g4', 'd7d5', 'f1g2', 'e7e5', 'd2d4', 'e5d4', 'c2c3']	183
A00	Grob Opening: Grob Gambit, Richter-Grob Gambit	1. g4 d5 2. Bg2 c6 3. c4 dxc4 4. b3	['g2g4', 'd7d5', 'f1g2', 'c7c6', 'c2c4', 'd5c4', 'b2b3']	7275
A00	Grob Opening: Keene Defense	1. g4 d5 2. h3 e5 3. Bg2 c6	['g2g4', 'd7d5', 'h2h3', 'e7e5', 'f1g2', 'c7c6']	150353
A00	Grob Opening: Keene Defense, Main Line	1. g4 d5 2. h3 e5 3. Bg2 c6 4. d4 e4 5. c4 Bd6 6. Nc3 Ne7	['g2g4', 'd7d5', 'h2h3', 'e7e5', 'f1g2', 'c7c6', 'd2d4', 'e5e4', 'c2c4', 'f8d6', 'b1c3', 'g8e7']	1575
A00	Grob Opening: London Defense	1. g4 e5 2. h3 Nc6	['g2g4', 'e7e5', 'h2h3', 'b8c6']	57169
A00	Grob Opening: Romford Countergambit	1. g4 d5 2. Bg2 Bxg4 3. c4 d4	['g2g4', 'd7d5', 'f1g2', 'c8g4', 'c2c4', 'd5d4']	21298
A00	Grob Opening: Spike Attack	1. g4 d5 2. Bg2 c6 3. g5	['g2g4', 'd7d5', 'f1g2', 'c7c6', 'g4g5']	158189
A00	Grob Opening: Spike, Hurst Attack	1. g4 e5 2. Bg2 d5 3. c4	['g2g4', 'e7e5', 'f1g2', 'd7d5', 'c2c4']	793484
A00	Grob Opening: Zilbermints Gambit	1. g4 d5 2. e4 dxe4 3. Nc3	['g2g4', 'd7d5', 'e2e4', 'd5e4', 'b1c3']	5819
A00	Grob Opening: Zilbermints Gambit, Schiller Defense	1. g4 d5 2. e4 dxe4 3. Nc3 h5	['g2g4', 'd7d5', 'e2e4', 'd5e4', 'b1c3', 'h7h5']	180
A00	Grob Opening: Zilbermints Gambit, Zilbermints-Hartlaub Gambit	1. g4 d5 2. e4 dxe4 3. Nc3 e5 4. d3	['g2g4', 'd7d5', 'e2e4', 'd5e4', 'b1c3', 'e7e5', 'd2d3']	398
A00	Hungarian Opening	1. g3	['g2g3']	80904135
A00	Hungarian Opening: Asten Gambit	1. g3 Nc6 2. Nc3 d5 3. d4 e5 4. dxe5 d4 5. Ne4 f5	['g2g3', 'b8c6', 'b1c3', 'd7d5', 'd2d4', 'e7e5', 'd4e5', 'd5d4', 'c3e4', 'f7f5']	10
A00	Hungarian Opening: Burk Gambit	1. g3 e5 2. a3 d5 3. Nf3 e4 4. Nh4 Be7 5. d3	['g2g3', 'e7e5', 'a2a3', 'd7d5', 'g1f3', 'e5e4', 'f3h4', 'f8e7', 'd2d3']	61
A00	Hungarian Opening: Bücker Gambit	1. g3 d5 2. Bg2 e5 3. b4	['g2g3', 'd7d5', 'f1g2', 'e7e5', 'b2b4']	9208
A00	Hungarian Opening: Catalan Formation	1. g3 d5 2. Bg2 e6	['g2g3', 'd7d5', 'f1g2', 'e7e6']	6274957
A00	Hungarian Opening: Dutch Defense	1. g3 f5	['g2g3', 'f7f5']	789702
A00	Hungarian Opening: Indian Defense	1. g3 Nf6	['g2g3', 'g8f6']	6148480
A00	Hungarian Opening: Myers Defense	1. g3 g5	['g2g3', 'g7g5']	158309
A00	Hungarian Opening: Pachman Gambit	1. g3 f5 2. e4 fxe4 3. Qh5+ g6	['g2g3', 'f7f5', 'e2e4', 'f5e4', 'd1h5', 'g7g6']	248
A00	Hungarian Opening: Paris Gambit	1. g3 e5 2. Nh3 d5 3. f4 Bxh3 4. Bxh3 exf4 5. O-O	['g2g3', 'e7e5', 'g1h3', 'd7d5', 'f2f4', 'c8h3', 'f1h3', 'e5f4', 'e1g1']	786
A00	Hungarian Opening: Reversed Alekhine	1. g3 e5 2. Nf3	['g2g3', 'e7e5', 'g1f3']	1973784
A00	Hungarian Opening: Reversed Brooklyn Defense, Brooklyn Benko Gambit	1. g3 e5 2. Nf3 e4 3. Ng1 Nf6 4. b4	['g2g3', 'e7e5', 'g1f3', 'e5e4', 'f3g1', 'g8f6', 'b2b4']	3
A00	Hungarian Opening: Reversed Modern Defense	1. g3 d5 2. Bg2 c5	['g2g3', 'd7d5', 'f1g2', 'c7c5']	2034524
A00	Hungarian Opening: Reversed Norwegian Defense	1. g3 e5 2. Nf3 e4 3. Nh4	['g2g3', 'e7e5', 'g1f3', 'e5e4', 'f3h4']	29660
A00	Hungarian Opening: Sicilian Invitation	1. g3 c5	['g2g3', 'c7c5']	5722654
A00	Hungarian Opening: Slav Formation	1. g3 d5 2. Bg2 c6	['g2g3', 'd7d5', 'f1g2', 'c7c6']	6844586
A00	Hungarian Opening: Symmetrical Variation	1. g3 g6	['g2g3', 'g7g6']	5726282
A00	Hungarian Opening: Van Kuijk Gambit	1. g3 h5 2. Nf3 h4	['g2g3', 'h7h5', 'g1f3', 'h5h4']	56850
A00	Hungarian Opening: Winterberg Gambit	1. g3 d5 2. Bg2 e5 3. c4 dxc4 4. b3	['g2g3', 'd7d5', 'f1g2', 'e7e5', 'c2c4', 'd5c4', 'b2b3']	2583
A00	Kádas Opening	1. h4	['h2h4']	5839978
A00	Kádas Opening: Beginner's Trap	1. h4 d5 2. Rh3	['h2h4', 'd7d5', 'h1h3']	76090
A00	Kádas Opening: Kádas Gambit	1. h4 c5 2. b4	['h2h4', 'c7c5', 'b2b4']	1254
A00	Kádas Opening: Kádas Gambit	1. h4 d5 2. d4 c5 3. Nf3 cxd4 4. c3	['h2h4', 'd7d5', 'd2d4', 'c7c5', 'g1f3', 'c5d4', 'c2c3']	1418
A00	Kádas Opening: Kádas Gambit	1. h4 e5 2. d4 exd4 3. c3	['h2h4', 'e7e5', 'd2d4', 'e5d4', 'c2c3']	2954
A00	Kádas Opening: Myers Variation	1. h4 d5 2. d4 c5 3. e4	['h2h4', 'd7d5', 'd2d4', 'c7c5', 'e2e4']	637
A00	Kádas Opening: Schneider Gambit	1. h4 g5	['h2h4', 'g7g5']	28038
A00	Kádas Opening: Steinbok Gambit	1. h4 f5 2. e4 fxe4 3. d3	['h2h4', 'f7f5', 'e2e4', 'f5e4', 'd2d3']	288
A00	Lasker Simul Special	1. g3 h5	['g2g3', 'h7h5']	880952
A00	Mieses Opening	1. d3	['d2d3']	43529620
A00	Mieses Opening: Myers Spike Attack	1. d3 g6 2. g4	['d2d3', 'g7g6', 'g2g4']	4645
A00	Mieses Opening: Reversed Rat	1. d3 e5	['d2d3', 'e7e5']	9168540
A00	Polish Opening	1. b4	['b2b4']	19910505
A00	Polish Opening: Baltic Defense	1. b4 d5 2. Bb2 Bf5	['b2b4', 'd7d5', 'c1b2', 'c8f5']	317861
A00	Polish Opening: Birmingham Gambit	1. b4 c5	['b2b4', 'c7c5']	540613
A00	Polish Opening: Bugayev Advance Variation	1. b4 e5 2. Bb2 f6 3. b5	['b2b4', 'e7e5', 'c1b2', 'f7f6', 'b4b5']	211668
A00	Polish Opening: Bugayev Attack	1. b4 e5 2. a3	['b2b4', 'e7e5', 'a2a3']	777843
A00	Polish Opening: Czech Defense	1. b4 e5 2. Bb2 d6	['b2b4', 'e7e5', 'c1b2', 'd7d6']	1908659
A00	Polish Opening: Dutch Defense	1. b4 f5	['b2b4', 'f7f5']	208962
A00	Polish Opening: German Defense	1. b4 d5 2. Bb2 Qd6	['b2b4', 'd7d5', 'c1b2', 'd8d6']	48725
A00	Polish Opening: Grigorian Variation	1. b4 Nc6	['b2b4', 'b8c6']	209227
A00	Polish Opening: Karniewski Variation	1. b4 Nh6	['b2b4', 'g8h6']	4964
A00	Polish Opening: King's Indian Variation	1. b4 Nf6 2. Bb2 g6	['b2b4', 'g8f6', 'c1b2', 'g7g6']	1181181
A00	Polish Opening: King's Indian Variation, Schiffler Attack	1. b4 Nf6 2. Bb2 g6 3. e4	['b2b4', 'g8f6', 'c1b2', 'g7g6', 'e2e4']	94733
A00	Polish Opening: King's Indian Variation, Sokolsky Attack	1. b4 Nf6 2. Bb2 g6 3. c4 Bg7 4. e3 d6 5. Nf3 O-O 6. d4	['b2b4', 'g8f6', 'c1b2', 'g7g6', 'c2c4', 'f8g7', 'e2e3', 'd7d6', 'g1f3', 'e8g8', 'd2d4']	69061
A00	Polish Opening: Myers Variation	1. b4 d5 2. Bb2 c6 3. a4	['b2b4', 'd7d5', 'c1b2', 'c7c6', 'a2a4']	60355
A00	Polish Opening: Outflank Variation	1. b4 c6	['b2b4', 'c7c6']	767599
A00	Polish Opening: Queen's Indian Variation	1. b4 e6 2. Bb2 Nf6 3. b5 b6	['b2b4', 'e7e6', 'c1b2', 'g8f6', 'b4b5', 'b7b6']	71981
A00	Polish Opening: Queenside Defense	1. b4 e6 2. Bb2 Nf6 3. b5 a6	['b2b4', 'e7e6', 'c1b2', 'g8f6', 'b4b5', 'a7a6']	87595
A00	Polish Opening: Rooks Swap Line	1. b4 e6 2. Bb2 Nf6 3. b5 a6 4. a4 axb5 5. axb5 Rxa1 6. Bxa1	['b2b4', 'e7e6', 'c1b2', 'g8f6', 'b4b5', 'a7a6', 'a2a4', 'a6b5', 'a4b5', 'a8a1', 'b2a1']	52028
A00	Polish Opening: Schiffler-Sokolsky Variation	1. b4 e6 2. Bb2 Nf6 3. b5 d5 4. e3	['b2b4', 'e7e6', 'c1b2', 'g8f6', 'b4b5', 'd7d5', 'e2e3']	424455
A00	Polish Opening: Schuehler Gambit	1. b4 c6 2. Bb2 a5 3. b5 cxb5 4. e4	['b2b4', 'c7c6', 'c1b2', 'a7a5', 'b4b5', 'c6b5', 'e2e4']	969
A00	Polish Opening: Symmetrical Variation	1. b4 b5	['b2b4', 'b7b5']	230109
A00	Polish Opening: Tartakower Gambit	1. b4 e5 2. Bb2 f6 3. e4	['b2b4', 'e7e5', 'c1b2', 'f7f6', 'e2e4']	49472
A00	Polish Opening: Wolferts Gambit	1. b4 e5 2. Bb2 c5	['b2b4', 'e7e5', 'c1b2', 'c7c5']	10978
A00	Saragossa Opening	1. c3	['c2c3']	14826782
A00	Sodium Attack	1. Na3	['b1a3']	511814
A00	Sodium Attack: Chenoboskion Variation	1. Na3 g6 2. g4	['b1a3', 'g7g6', 'g2g4']	241
A00	Sodium Attack: Durkin Gambit	1. Na3 e5 2. Nc4 Nc6 3. e4 f5	['b1a3', 'e7e5', 'a3c4', 'b8c6', 'e2e4', 'f7f5']	279
A00	Valencia Opening	1. d3 e5 2. Nd2	['d2d3', 'e7e5', 'b1d2']	548604
A00	Van Geet Opening	1. Nc3	['b1c3']	28974341
A00	Van Geet Opening: Battambang Variation	1. a3 e5 2. Nc3	['a2a3', 'e7e5', 'b1c3']	137800
A00	Van Geet Opening: Billockus-Johansen Gambit	1. Nc3 e5 2. Nf3 Bc5	['b1c3', 'e7e5', 'g1f3', 'f8c5']	111813
A00	Van Geet Opening: Caro-Kann Variation, St. Patrick's Attack	1. Nc3 d5 2. e4 c6 3. h3	['b1c3', 'd7d5', 'e2e4', 'c7c6', 'h2h3']	21608
A00	Van Geet Opening: Damhaug Gambit	1. Nc3 d5 2. f4 e5	['b1c3', 'd7d5', 'f2f4', 'e7e5']	4352
A00	Van Geet Opening: Dougherty Gambit	1. Nc3 d5 2. e4 dxe4 3. f3	['b1c3', 'd7d5', 'e2e4', 'd5e4', 'f2f3']	123879
A00	Van Geet Opening: Dunst-Perrenet Gambit	1. Nc3 d5 2. e4 dxe4 3. d3	['b1c3', 'd7d5', 'e2e4', 'd5e4', 'd2d3']	1140690
A00	Van Geet Opening: Düsseldorf Gambit	1. Nc3 c5 2. b4	['b1c3', 'c7c5', 'b2b4']	2874
A00	Van Geet Opening: Gladbacher Gambit	1. Nc3 e5 2. b3 d5 3. e4 dxe4 4. d3	['b1c3', 'e7e5', 'b2b3', 'd7d5', 'e2e4', 'd5e4', 'd2d3']	606
A00	Van Geet Opening: Hector Gambit	1. Nc3 d5 2. e4 dxe4 3. Bc4	['b1c3', 'd7d5', 'e2e4', 'd5e4', 'f1c4']	84312
A00	Van Geet Opening: Hergert Gambit	1. Nc3 d6 2. f4 e5 3. fxe5 Nc6	['b1c3', 'd7d6', 'f2f4', 'e7e5', 'f4e5', 'b8c6']	3148
A00	Van Geet Opening: Hulsemann Gambit	1. Nc3 e5 2. e3 d5 3. Qh5 Be6	['b1c3', 'e7e5', 'e2e3', 'd7d5', 'd1h5', 'c8e6']	1033
A00	Van Geet Opening: Jendrossek Gambit	1. Nc3 d5 2. f4 d4 3. Ne4 f5 4. Nf2 Nf6 5. Nf3 c5 6. b4	['b1c3', 'd7d5', 'f2f4', 'd5d4', 'c3e4', 'f7f5', 'e4f2', 'g8f6', 'g1f3', 'c7c5', 'b2b4']	3
A00	Van Geet Opening: Kluever Gambit	1. Nc3 f5 2. e4 fxe4 3. d3	['b1c3', 'f7f5', 'e2e4', 'f5e4', 'd2d3']	40135
A00	Van Geet Opening: Laroche Gambit	1. Nc3 b5	['b1c3', 'b7b5']	125547
A00	Van Geet Opening: Liebig Gambit	1. Nc3 e5 2. e3 d5 3. Qh5 Nf6	['b1c3', 'e7e5', 'e2e3', 'd7d5', 'd1h5', 'g8f6']	14077
A00	Van Geet Opening: Melleby Gambit	1. Nc3 d5 2. f4 d4 3. Ne4 c5	['b1c3', 'd7d5', 'f2f4', 'd5d4', 'c3e4', 'c7c5']	2327
A00	Van Geet Opening: Myers Attack	1. Nc3 g6 2. h4	['b1c3', 'g7g6', 'h2h4']	33872
A00	Van Geet Opening: Napoleon Attack	1. Nc3 e5 2. Nf3 Nc6 3. d4	['b1c3', 'e7e5', 'g1f3', 'b8c6', 'd2d4']	668958
A00	Van Geet Opening: Novosibirsk Variation	1. Nc3 c5 2. d4 cxd4 3. Qxd4 Nc6 4. Qh4	['b1c3', 'c7c5', 'd2d4', 'c5d4', 'd1d4', 'b8c6', 'd4h4']	121030
A00	Van Geet Opening: Nowokunski Gambit	1. Nc3 e5 2. f4 exf4 3. e4	['b1c3', 'e7e5', 'f2f4', 'e5f4', 'e2e4']	2030
A00	Van Geet Opening: Pfeiffer Gambit	1. Nc3 d5 2. f4 d4 3. Ne4 e5	['b1c3', 'd7d5', 'f2f4', 'd5d4', 'c3e4', 'e7e5']	619
A00	Van Geet Opening: Pfeiffer Gambit, Sleipnir Countergambit	1. Nc3 d5 2. f4 d4 3. Ne4 e5 4. Nf3	['b1c3', 'd7d5', 'f2f4', 'd5d4', 'c3e4', 'e7e5', 'g1f3']	91
A00	Van Geet Opening: Reversed Nimzowitsch	1. Nc3 e5	['b1c3', 'e7e5']	6998966
A00	Van Geet Opening: Reversed Scandinavian	1. Nc3 e5 2. d4 exd4 3. Qxd4 Nc6 4. Qa4	['b1c3', 'e7e5', 'd2d4', 'e5d4', 'd1d4', 'b8c6', 'd4a4']	105911
A00	Van Geet Opening: Sicilian Two Knights	1. Nc3 c5 2. Nf3 Nc6 3. d4 cxd4 4. Nxd4	['b1c3', 'c7c5', 'g1f3', 'b8c6', 'd2d4', 'c5d4', 'f3d4']	281586
A00	Van Geet Opening: Sleipnir Gambit	1. Nc3 d5 2. e3 e5 3. d4 Bb4	['b1c3', 'd7d5', 'e2e3', 'e7e5', 'd2d4', 'f8b4']	7248
A00	Van Geet Opening: Twyble Attack	1. Nc3 c5 2. Rb1	['b1c3', 'c7c5', 'a1b1']	717
A00	Van Geet Opening: Tübingen Gambit	1. Nc3 Nf6 2. g4	['b1c3', 'g8f6', 'g2g4']	37120
A00	Van Geet Opening: Venezolana Variation	1. Nc3 d5 2. d3 Nf6 3. g3	['b1c3', 'd7d5', 'd2d3', 'g8f6', 'g2g3']	18833
A00	Van Geet Opening: Warsteiner Gambit	1. Nc3 d5 2. f4 g5	['b1c3', 'd7d5', 'f2f4', 'g7g5']	144
A00	Van't Kruijs Opening	1. e3	['e2e3']	104599165
A00	Van't Kruijs Opening: Bouncing Bishop Variation	1. e3 e5 2. Bc4 b5 3. Bb3	['e2e3', 'e7e5', 'f1c4', 'b7b5', 'c4b3']	960
A00	Van't Kruijs Opening: Keoni-Hiva Gambit, Akahi Variation	1. e3 e5 2. Nc3 Nf6 3. f4 exf4 4. Nf3	['e2e3', 'e7e5', 'b1c3', 'g8f6', 'f2f4', 'e5f4', 'g1f3']	1868
A00	Van't Kruijs Opening: Keoni-Hiva Gambit, Alua Variation	1. e3 e5 2. Nc3 Nc6 3. f4 exf4 4. Nf3	['e2e3', 'e7e5', 'b1c3', 'b8c6', 'f2f4', 'e5f4', 'g1f3']	1829
A00	Van't Kruijs Opening: Keoni-Hiva Gambit, Ekolu Variation	1. e3 e5 2. Nc3 d5 3. f4 exf4 4. Nf3	['e2e3', 'e7e5', 'b1c3', 'd7d5', 'f2f4', 'e5f4', 'g1f3']	2053
A00	Venezolana Opening	1. d3 c5 2. Nc3 Nc6 3. g3	['d2d3', 'c7c5', 'b1c3', 'b8c6', 'g2g3']	5565
A00	Ware Opening	1. a4	['a2a4']	4140772
A00	Ware Opening: Meadow Hay Trap	1. a4 e5 2. Ra3	['a2a4', 'e7e5', 'a1a3']	118883
A00	Ware Opening: Ware Gambit	1. a4 e5 2. a5 d5 3. e3 f5 4. a6	['a2a4', 'e7e5', 'a4a5', 'd7d5', 'e2e3', 'f7f5', 'a5a6']	474
A00	Ware Opening: Wing Gambit	1. a4 b5 2. axb5 Bb7	['a2a4', 'b7b5', 'a4b5', 'c8b7']	964
A01	Nimzo-Larsen Attack	1. b3	['b2b3']	71203176
A01	Nimzo-Larsen Attack: Classical Variation	1. b3 d5	['b2b3', 'd7d5']	16583657
A01	Nimzo-Larsen Attack: Dutch Variation	1. b3 f5	['b2b3', 'f7f5']	645559
A01	Nimzo-Larsen Attack: English Variation	1. b3 c5	['b2b3', 'c7c5']	4752630
A01	Nimzo-Larsen Attack: Graz Attack	1. b3 d5 2. Ba3	['b2b3', 'd7d5', 'c1a3']	212948
A01	Nimzo-Larsen Attack: Indian Variation	1. b3 Nf6	['b2b3', 'g8f6']	8141125
A01	Nimzo-Larsen Attack: Modern Variation	1. b3 e5	['b2b3', 'e7e5']	19600105
A01	Nimzo-Larsen Attack: Modern Variation	1. b3 e5 2. Bb2 Nc6	['b2b3', 'e7e5', 'c1b2', 'b8c6']	10232009
A01	Nimzo-Larsen Attack: Modern Variation	1. b3 e5 2. Bb2 Nc6 3. e3	['b2b3', 'e7e5', 'c1b2', 'b8c6', 'e2e3']	5341110
A01	Nimzo-Larsen Attack: Pachman Gambit	1. b3 e5 2. Bb2 Nc6 3. f4	['b2b3', 'e7e5', 'c1b2', 'b8c6', 'f2f4']	71236
A01	Nimzo-Larsen Attack: Polish Variation	1. b3 b5	['b2b3', 'b7b5']	166682
A01	Nimzo-Larsen Attack: Ringelbach Gambit	1. b3 f5 2. Bb2 e6 3. e4	['b2b3', 'f7f5', 'c1b2', 'e7e6', 'e2e4']	12862
A01	Nimzo-Larsen Attack: Spike Variation	1. b3 Nf6 2. Bb2 g6 3. g4	['b2b3', 'g8f6', 'c1b2', 'g7g6', 'g2g4']	323080
A01	Nimzo-Larsen Attack: Symmetrical Variation	1. b3 b6	['b2b3', 'b7b6']	2473857
A02	Bird Opening	1. f4	['f2f4']	43206874
A02	Bird Opening	1. f4 Nf6	['f2f4', 'g8f6']	2841170
A02	Bird Opening: Batavo-Polish Attack	1. f4 Nf6 2. Nf3 g6 3. b4	['f2f4', 'g8f6', 'g1f3', 'g7g6', 'b2b4']	1070
A02	Bird Opening: Double Duck Formation	1. f4 f5 2. d4 d5	['f2f4', 'f7f5', 'd2d4', 'd7d5']	199800
A02	Bird Opening: From's Gambit	1. f4 e5	['f2f4', 'e7e5']	4442399
A02	Bird Opening: From's Gambit, Bahr Gambit	1. f4 e5 2. Nc3	['f2f4', 'e7e5', 'b1c3']	64829
A02	Bird Opening: From's Gambit, Langheld Gambit	1. f4 e5 2. fxe5 d6 3. exd6 Nf6	['f2f4', 'e7e5', 'f4e5', 'd7d6', 'e5d6', 'g8f6']	11585
A02	Bird Opening: From's Gambit, Lasker Variation	1. f4 e5 2. fxe5 d6 3. exd6 Bxd6 4. Nf3 g5	['f2f4', 'e7e5', 'f4e5', 'd7d6', 'e5d6', 'f8d6', 'g1f3', 'g7g5']	368182
A02	Bird Opening: From's Gambit, Lipke Variation	1. f4 e5 2. fxe5 d6 3. exd6 Bxd6 4. Nf3 Nh6 5. d4	['f2f4', 'e7e5', 'f4e5', 'd7d6', 'e5d6', 'f8d6', 'g1f3', 'g8h6', 'd2d4']	1665
A02	Bird Opening: Hobbs Gambit	1. f4 g5	['f2f4', 'g7g5']	123965
A02	Bird Opening: Hobbs-Zilbermints Gambit	1. f4 h6 2. Nf3 g5	['f2f4', 'h7h6', 'g1f3', 'g7g5']	9184
A02	Bird Opening: Horsefly Defense	1. f4 Nh6	['f2f4', 'g8h6']	52324
A02	Bird Opening: Lasker Gambit	1. f4 e5 2. fxe5 f6	['f2f4', 'e7e5', 'f4e5', 'f7f6']	84481
A02	Bird Opening: Mujannah	1. f4 Nf6 2. c4	['f2f4', 'g8f6', 'c2c4']	61922
A02	Bird Opening: Myers Defense	1. f4 b5	['f2f4', 'b7b5']	70120
A02	Bird Opening: Platz Gambit	1. f4 e5 2. fxe5 Ne7	['f2f4', 'e7e5', 'f4e5', 'g8e7']	4027
A02	Bird Opening: Schlechter Gambit	1. f4 e5 2. fxe5 Nc6	['f2f4', 'e7e5', 'f4e5', 'b8c6']	522542
A02	Bird Opening: Siegener Gambit	1. f4 e5 2. d4 exd4 3. Nf3 c5 4. c3	['f2f4', 'e7e5', 'd2d4', 'e5d4', 'g1f3', 'c7c5', 'c2c3']	757
A02	Bird Opening: Swiss Gambit	1. f4 f5 2. e4 fxe4 3. Nc3 Nf6 4. g4	['f2f4', 'f7f5', 'e2e4', 'f5e4', 'b1c3', 'g8f6', 'g2g4']	512
A02	Bird Opening: Wagner-Zwitersch Gambit	1. f4 f5 2. e4	['f2f4', 'f7f5', 'e2e4']	158107
A03	Bird Opening: Dutch Variation	1. f4 d5	['f2f4', 'd7d5']	15090416
A03	Bird Opening: Dutch Variation, Dudweiler Gambit	1. f4 d5 2. g4	['f2f4', 'd7d5', 'g2g4']	118719
A03	Bird Opening: Lasker Variation	1. f4 d5 2. Nf3 Nf6 3. e3 c5	['f2f4', 'd7d5', 'g1f3', 'g8f6', 'e2e3', 'c7c5']	387247
A03	Bird Opening: Sturm Gambit	1. f4 d5 2. c4	['f2f4', 'd7d5', 'c2c4']	191984
A03	Bird Opening: Thomas Gambit	1. f4 d5 2. b3 Nf6 3. Bb2 d4 4. Nf3 c5 5. e3	['f2f4', 'd7d5', 'b2b3', 'g8f6', 'c1b2', 'd5d4', 'g1f3', 'c7c5', 'e2e3']	3645
A03	Bird Opening: Williams Gambit	1. f4 d5 2. e4	['f2f4', 'd7d5', 'e2e4']	2192376
A03	Bird Opening: Williams Gambit	1. f4 d5 2. e4 dxe4 3. Nc3 Nf6 4. Qe2	['f2f4', 'd7d5', 'e2e4', 'd5e4', 'b1c3', 'g8f6', 'd1e2']	86749
A03	Bird Opening: Williams-Zilbermints Gambit	1. f4 d5 2. e4 dxe4 3. Nc3 Nf6 4. Nge2	['f2f4', 'd7d5', 'e2e4', 'd5e4', 'b1c3', 'g8f6', 'g1e2']	60902
A04	Colle System: Rhamphorhynchus Variation	1. Nf3 c5 2. e3 g6 3. d4 Bg7 4. dxc5 Qa5+	['g1f3', 'c7c5', 'e2e3', 'g7g6', 'd2d4', 'f8g7', 'd4c5', 'd8a5']	21662
A04	Modern Defense: Semi-Averbakh Variation, Polish Variation	1. Nf3 c5 2. c4 g6 3. d4 Bg7 4. e4 Qb6	['g1f3', 'c7c5', 'c2c4', 'g7g6', 'd2d4', 'f8g7', 'e2e4', 'd8b6']	5293
A04	Modern Defense: Semi-Averbakh Variation, Pterodactyl Variation	1. Nf3 c5 2. c4 g6 3. d4 Bg7 4. e4 Qa5+	['g1f3', 'c7c5', 'c2c4', 'g7g6', 'd2d4', 'f8g7', 'e2e4', 'd8a5']	5015
A04	Modern Defense: Semi-Averbakh Variation, Pterodactyl Variation Accepted	1. Nf3 g6 2. d4 Bg7 3. e4 d6 4. c4 c5 5. dxc5 Qa5+	['g1f3', 'g7g6', 'd2d4', 'f8g7', 'e2e4', 'd7d6', 'c2c4', 'c7c5', 'd4c5', 'd8a5']	6850
A04	Zukertort Defense: Kingside Variation	1. Nf3 Nh6 2. d4 g6	['g1f3', 'g8h6', 'd2d4', 'g7g6']	26861
A04	Zukertort Defense: Sicilian Knight Variation	1. Nf3 Na6 2. e4 c5	['g1f3', 'b8a6', 'e2e4', 'c7c5']	38352
A04	Zukertort Opening	1. Nf3	['g1f3']	165881072
A04	Zukertort Opening: Arctic Defense	1. Nf3 f6	['g1f3', 'f7f6']	1010386
A04	Zukertort Opening: Arctic Defense, Drunken Knight Variation	1. Nf3 f6 2. e4 Nh6 3. d4 Nf7	['g1f3', 'f7f6', 'e2e4', 'g8h6', 'd2d4', 'h6f7']	20835
A04	Zukertort Opening: Basman Defense	1. Nf3 h6	['g1f3', 'h7h6']	313422
A04	Zukertort Opening: Black Mustang Defense	1. Nf3 Nc6	['g1f3', 'b8c6']	11578456
A04	Zukertort Opening: Drunken Cavalry Variation	1. Nf3 Na6 2. e4 Nh6	['g1f3', 'b8a6', 'e2e4', 'g8h6']	25822
A04	Zukertort Opening: Dutch Variation	1. Nf3 f5	['g1f3', 'f7f5']	2406960
A04	Zukertort Opening: Herrstrom Gambit	1. Nf3 g5	['g1f3', 'g7g5']	426109
A04	Zukertort Opening: Kingside Fianchetto	1. Nf3 g6	['g1f3', 'g7g6']	9063383
A04	Zukertort Opening: Lisitsyn Gambit	1. Nf3 f5 2. e4	['g1f3', 'f7f5', 'e2e4']	574059
A04	Zukertort Opening: Lisitsyn Gambit Deferred	1. Nf3 f5 2. d3 Nf6 3. e4	['g1f3', 'f7f5', 'd2d3', 'g8f6', 'e2e4']	58600
A04	Zukertort Opening: Pirc Invitation	1. Nf3 d6	['g1f3', 'd7d6']	9256913
A04	Zukertort Opening: Polish Defense	1. Nf3 b5	['g1f3', 'b7b5']	252588
A04	Zukertort Opening: Queen's Gambit Invitation	1. Nf3 e6	['g1f3', 'e7e6']	15662901
A04	Zukertort Opening: Queenside Fianchetto Variation	1. Nf3 b6	['g1f3', 'b7b6']	4557129
A04	Zukertort Opening: Ross Gambit	1. Nf3 e5	['g1f3', 'e7e5']	8890314
A04	Zukertort Opening: Shabalov Gambit	1. Nf3 e6 2. c4 a6 3. Nc3 c5 4. g3 b5	['g1f3', 'e7e6', 'c2c4', 'a7a6', 'b1c3', 'c7c5', 'g2g3', 'b7b5']	871
A04	Zukertort Opening: Sicilian Invitation	1. Nf3 c5	['g1f3', 'c7c5']	15778897
A04	Zukertort Opening: Slav Invitation	1. Nf3 c6	['g1f3', 'c7c6']	7515091
A04	Zukertort Opening: Speelsmet Gambit	1. Nf3 c5 2. d4 cxd4 3. e3	['g1f3', 'c7c5', 'd2d4', 'c5d4', 'e2e3']	380095
A04	Zukertort Opening: St. George Defense	1. Nf3 a6	['g1f3', 'a7a6']	393924
A04	Zukertort Opening: The Walrus	1. Nf3 e5 2. Nxe5 Nc6 3. Nxc6 dxc6	['g1f3', 'e7e5', 'f3e5', 'b8c6', 'e5c6', 'd7c6']	363700
A04	Zukertort Opening: Vos Gambit	1. Nf3 d6 2. d4 e5	['g1f3', 'd7d6', 'd2d4', 'e7e5']	1132944
A04	Zukertort Opening: Wade Defense	1. Nf3 d6 2. e4 Bg4	['g1f3', 'd7d6', 'e2e4', 'c8g4']	1011461
A04	Zukertort Opening: Ware Defense	1. Nf3 a5	['g1f3', 'a7a5']	241457
A05	King's Indian Attack	1. Nf3 Nf6 2. g3 d5	['g1f3', 'g8f6', 'g2g3', 'd7d5']	4448351
A05	King's Indian Attack: Smyslov Variation	1. Nf3 Nf6 2. g3 g6 3. b4	['g1f3', 'g8f6', 'g2g3', 'g7g6', 'b2b4']	22119
A05	King's Indian Attack: Spassky Variation	1. Nf3 Nf6 2. g3 b5	['g1f3', 'g8f6', 'g2g3', 'b7b5']	65423
A05	King's Indian Attack: Symmetrical Defense	1. Nf3 Nf6 2. g3 g6	['g1f3', 'g8f6', 'g2g3', 'g7g6']	3799704
A05	King's Indian Attack: Wahls Defense	1. Nf3 Nf6 2. g3 g6 3. Bg2 Bg7 4. O-O O-O 5. d3 d5	['g1f3', 'g8f6', 'g2g3', 'g7g6', 'f1g2', 'f8g7', 'e1g1', 'e8g8', 'd2d3', 'd7d5']	810979
A05	Polish Opening: Zukertort System	1. Nf3 Nf6 2. b4	['g1f3', 'g8f6', 'b2b4']	76939
A05	Zukertort Opening	1. Nf3 Nf6	['g1f3', 'g8f6']	25671896
A05	Zukertort Opening	1. Nf3 Nf6 2. Nc3 Nc6	['g1f3', 'g8f6', 'b1c3', 'b8c6']	744241
A05	Zukertort Opening: Double Fianchetto Attack	1. Nf3 Nf6 2. g3 g6 3. b3 Bg7 4. Bb2 O-O 5. Bg2 d6 6. O-O	['g1f3', 'g8f6', 'g2g3', 'g7g6', 'b2b3', 'f8g7', 'c1b2', 'e8g8', 'f1g2', 'd7d6', 'e1g1']	172493
A05	Zukertort Opening: Lemberger Gambit	1. Nf3 Nf6 2. e4	['g1f3', 'g8f6', 'e2e4']	5950769
A05	Zukertort Opening: Myers Polish Attack	1. Nf3 Nf6 2. a4 g6 3. b4	['g1f3', 'g8f6', 'a2a4', 'g7g6', 'b2b4']	492
A05	Zukertort Opening: Nimzo-Larsen Variation	1. Nf3 Nf6 2. b3	['g1f3', 'g8f6', 'b2b3']	1386826
A05	Zukertort Opening: Quiet System	1. Nf3 Nf6 2. e3	['g1f3', 'g8f6', 'e2e3']	1730478
A06	Nimzo-Larsen Attack: Classical Variation	1. Nf3 d5 2. b3	['g1f3', 'd7d5', 'b2b3']	2323094
A06	Nimzo-Larsen Attack: Norfolk Gambit	1. Nf3 d5 2. b3 c5 3. e4	['g1f3', 'd7d5', 'b2b3', 'c7c5', 'e2e4']	19732
A06	Nimzo-Larsen Attack: Norfolk Gambit	1. Nf3 d5 2. b3 Nf6 3. Bb2 c5 4. e4	['g1f3', 'd7d5', 'b2b3', 'g8f6', 'c1b2', 'c7c5', 'e2e4']	1206
A06	Zukertort Opening	1. Nf3 d5	['g1f3', 'd7d5']	52294682
A06	Zukertort Opening: Ampel Variation	1. Nf3 d5 2. Rg1	['g1f3', 'd7d5', 'h1g1']	9595
A06	Zukertort Opening: Old Indian Attack	1. Nf3 d5 2. d3	['g1f3', 'd7d5', 'd2d3']	4148065
A06	Zukertort Opening: Pachman Gambit	1. Nf3 d5 2. e3 c5 3. c4 dxc4 4. b3	['g1f3', 'd7d5', 'e2e3', 'c7c5', 'c2c4', 'd5c4', 'b2b3']	112
A06	Zukertort Opening: Regina-Nu Gambit	1. Nf3 d5 2. b3 c5 3. c4 dxc4 4. Nc3	['g1f3', 'd7d5', 'b2b3', 'c7c5', 'c2c4', 'd5c4', 'b1c3']	122
A06	Zukertort Opening: Reversed Mexican Defense	1. Nf3 d5 2. Nc3	['g1f3', 'd7d5', 'b1c3']	3050769
A06	Zukertort Opening: Santasiere's Folly	1. b4 d5 2. Nf3	['b2b4', 'd7d5', 'g1f3']	138100
A06	Zukertort Opening: Tennison Gambit	1. e4 d5 2. Nf3	['e2e4', 'd7d5', 'g1f3']	26900587
A06	Zukertort Opening: The Potato	1. Nf3 d5 2. a4	['g1f3', 'd7d5', 'a2a4']	36503
A07	Hungarian Opening: Wiedenhagen-Beta Gambit	1. g3 d5 2. Nf3 g5	['g2g3', 'd7d5', 'g1f3', 'g7g5']	3786
A07	King's Indian Attack	1. Nf3 d5 2. g3	['g1f3', 'd7d5', 'g2g3']	13364189
A07	King's Indian Attack: Double Fianchetto	1. Nf3 d5 2. g3 g6	['g1f3', 'd7d5', 'g2g3', 'g7g6']	249525
A07	King's Indian Attack: Keres Variation	1. Nf3 d5 2. g3 Bg4	['g1f3', 'd7d5', 'g2g3', 'c8g4']	772673
A07	King's Indian Attack: Keres Variation	1. Nf3 d5 2. g3 Bg4 3. Bg2 Nd7	['g1f3', 'd7d5', 'g2g3', 'c8g4', 'f1g2', 'b8d7']	52436
A07	King's Indian Attack: Omega-Delta Gambit	1. Nf3 d5 2. g3 e5	['g1f3', 'd7d5', 'g2g3', 'e7e5']	489164
A07	King's Indian Attack: Pachman System	1. Nf3 d5 2. g3 g6 3. Bg2 Bg7 4. O-O e5 5. d3 Ne7	['g1f3', 'd7d5', 'g2g3', 'g7g6', 'f1g2', 'f8g7', 'e1g1', 'e7e5', 'd2d3', 'g8e7']	45506
A07	King's Indian Attack: Sicilian Variation	1. Nf3 d5 2. g3 c5	['g1f3', 'd7d5', 'g2g3', 'c7c5']	2595784
A07	King's Indian Attack: Yugoslav Variation	1. Nf3 Nf6 2. g3 d5 3. Bg2 c6 4. O-O Bg4	['g1f3', 'g8f6', 'g2g3', 'd7d5', 'f1g2', 'c7c6', 'e1g1', 'c8g4']	776234
A08	King's Indian Attack: French Variation	1. Nf3 d5 2. g3 c5 3. Bg2 Nc6	['g1f3', 'd7d5', 'g2g3', 'c7c5', 'f1g2', 'b8c6']	2489582
